full_text,Overall
"I think students can benefit if they are able to attend classes from home, even know the distance but learning as a option for students who wants to finish a carear or have a good job.

Take those classes online or videos conferencing is not the same thing like to be able to go to classes. In class students can ask about any question they have or get the information they are looking for, and the schools teacher can see how they are learnig but, online they don't have much oction like read a book or be able to ask any question they have to anybody.

Attend to classse is great is a oction from student to choose but is the smart oction for for student who know what they want to do in they future. Schools is a place where students have the desition by you're own. There is where students can start makeing options and try finish what they really dream. Be able to atted classes from home is hard thing to discuss but when students are able to go there is great bacause is where they have to be and never give up during that time.

School is not a principle to starts getting information about how thing are working, or what options we can choose for be a porofessional after schools. Prevent oction in schools is preposterous because that is not ducing, good octions during school.

Students who rually have the decition to go to schools even know the distace but they are benefit. that is a oction, but when they get there is alot of information and option they can lissend from teachers and other students. When they go to schools they are giving a step more every day, to them life and they are benefit in school for the alot of option they can have in schools.

Schools is a benifif for all yung people to learnd how start life, when you get out from schools and have a good job. for have the opportunite, students need finish school firts. Not matter the distance or the skills they have during that period time. after that they will see how everything is change to be better in they way.

For somo students is hard to make that decition.

But when they have the oction and they can do it is a good thing because they can learning more about and have more opportunities when they graduate from schools thay have good jobs and more oction to choose.

Some students think is preposterous to to make decition in schools, bacause is alot of oction they can choose, and alot thing they want to be but they only have somo octions. For somo of then is hinder to go and pick that oportunities.

Instance when students live far fom schools is hard to get there they need like a car to get there, but parents are allways insist to students to go to schools not matter how hard is all they wants is a good future for they childrens.

School is a personality decition in life, butsmart decition for people who is looking for good oction in life. Ertheless who finish school have more oction the people who don't finish. During school students need have to be inmate because schools is a hard time.

For students in schools is like stairway, because they walk aroung getting information, that is a good oction for teachers, to stall information and try to preparate students to then life. One way to be a perfectionist is graduste from schools.

Fanally when students finish schools they did a good job and they have more option to choose. More of they have good jods or go to college and finish a carear, and they know how follow the the dreams, because when they was in chools there was alot of skills and the crusts those over and over that was like the firts hard thing they start with, that was alot of bad action they can choose but they don't choose any of those. Finally finish with right thing, Now is fancy work and alot oction to choose in life.                                                                                                          ",3.0
"I think ""taking online class is not a good idea and it, doesn't have any benefit for students"". Some of students asking for online class they think ""we can do it, but it is not too easy"". I used to have online class, and

""in my opinion online class is very hard""

. And doesn't have benefit. when there is no teacher in class to help students, and some of students are too lazy. they need some body to pust them in class.

in,

june 7,2017. I took my online class. And i was new in USA. That was really hard for me, because i was new here and, i didn't know. How i need to do my works? So that wasn't fun. And i didn't get any thing from that class. Because the class was boring for me and very day works became alot so, unfortunately i drop my class. It is very different; when we are in normal class or we are in online class. Because in normal class, there is a teacher, students and a lots of things to they can make class very easy for students. And have a lots of benenfits, but in online class there is noting of these stuff are in online class. And some times online class make students to skip

, because when they face to face with a problom. They can not ask from online class, teacher direct that make students to skip the class, and make the class boring for students, that is what happend with me. And some times student can not have good attend in class, and that can make student to drop the class.

As wall as online class and conferencing class are the hardest classes. But nothing is impossible in this life we can do it "" with hard work and with a good attend in our class"". If i need to take online class in future. I will always try to have communication with my teacher. Because teacher is the only person to can help the student on that class.                                                ",2.0
"Some schools thinks that students should attend classes at home. Others might think that attending classes at school will give benefits to the students. Attending classes at school will get the students to learn more subjects than online classes. If students does not attend classes at school there would not be teachers and staffs at the school.

Attending classes at school will get the students to learn more of other subjects. If a student takes classes at home they would not be focusing on their assignment. They going to be on their phone, TV, or other type of devices. There will be no one supervising the students at home. They need teachers to teach them, educate them, and motivate them to learn. Attending classes at school as you can see will benefit the student..

In addition, If the students does not attend classes at school there would not be no teachers and staffs at the school. Many jobs will be lost due to students taking classes online. Plus, the students needs to build a relationship with the teacher and staffs. Online classes would not teach a student face to face, It would be better If a teacher teaches the student face to face. As a result, there should be teachers and staff at the school, If the student takes classes at the school. Plus, the students will get a better education.

Many people may argue that students should take classes online instead of going to school. People think that online classes will give the student benefits. They also think that the benefit of taking online classes, is to give the students more opportunity to learn. In the other hand, they are people who also believe that taking classes in school is better. Schools are meant for students to learn on other subjects. If a student takes classes in school they will have the opportunity to learn much better.

Therefore, students should take classes in school. Schools are meant to be for students to learn from all subjects. Taking classes in school would benefit the students. If the students take classes in school, there will be more teachers and staff at the school. Truly, learning from a teacher helps you a lot, because they are teaching you face to face.",4.0
"Imagine there were no school and attending classes from home. I do not think students attendind classes from home by way of online or video conferencing will not benefit , Because classes at home will not benefit the student. He or She will take Advantages by watching online videos, Playing games and not studing. Students will not take classes from home serious.

Attending classes from home will be a distraction due to family issues and noises at home will not help student to pay attention.

Attending classes at home will not help student by not knowing general knowledge, Getting to know things around the world, Not able to meet new people and not being able to feel how the world is.

Some say attending classes from home by way of oline or video conferencing will be benefit for students they are wrong because, Some student needs help from their classmate. Some student also learn from teachers than attending classes from home by way of online or video conferencing.",2.5
"Online Learning

Who doesn't want to be left in the house all day using an electronic device with online access? Although students save money and time by taking classes from home. It is not beneficial to learn online because students lose focus of what they are learning and tend to easily get distracted when they're in their house, students can't have a one on one conversation with a teacher nor discuss with classmates, and students could also face technical difficulties when attending online classes from home.

Losing focus has a big impact in learning. For example, my friend Generic_Name sent me a text message last month, right when I started studying for my history mid-term exam. I responded back to Generic_Name's text, and without realizing we kept on messaging past midnight. This shows how easily students get distracted at home with a cellular device and how easy it is to lose focus. The next morning I decided to get to school an hour early and review one on one with my teacher.

Secondly, taking classes online doesn't just mean you don't have a physical teacher or instructor that you can question lively, but also means that it will be challenging to find answers to your questions. I remember in my sophomore year a kid in our econ class named Generic_Name was really sick for a while so he had ended up taking classes online. Generic_Name was a straight A student, always was first to answer the teachers questions and he also used to ask questions. Thankfully Generic_Name healed towards the end of the year and I asked him if he benefited and if he recommends attending classes from home. The straight A student Generic_Name said it was a real challenge to take the class online and he finished the class a month after he should have with a B- average. Generic_Name had also said that one of the most difficult parts about attending a class online was his laptop not functioning at all times, and not having a teacher you can talk and converse with one on one.

Finally, using your personal computer and internet connection can always be an issue. You can't always depend on your computer, not just the computers but even people aren't perfect. Another main problem Generic_Name had when attending classes online was his laptop and network connection. Generic_Name explained that he always faced technical difficulties. When his laptop wasn't functioning right, the only thing he could do was to stop the lesson and wait for his dad to get the laptop repaired, which took time. Each month, either his laptop or internet connection would not cooperate, so he finished the class a month later than everyone.

In conclusion, Everyone would like to save money and time by taking classes from home. But getting distracted, not asking your teacher questions when you need to, and wasting money on laptop repair is not worth it at all. Learning from a far distance could also be an option but when asking if it is beneficial, we can say that it is not by looking at the listed reasoning.    ",5.0
"Some schools offer distance learning as an option for students to attend classes from home by way of online or video conferencing. I think students would benefit from being able to attend classes from home. Distance learning students attend classes on time by online. Distance learning students also attend to school everyday. By way online you can attend to classes from anywhere.

First, distance learning students attend classes on time by online. In many states students live far from schools. Sometimes they can't be on time because of highway traffic. Sometimes cause of bad weather you have to drive slow than speed limit. And you can be late for school. If they late in every first classes they might fail that classes. Suppose they use the online conferencing they can be on time in every classes.

Also, attend to school everyday. Even if you sick for a week you still able to attend to school everyday by way of online or video conferencing. If weather is such a bad you can't go out of the house still able to attend classes from home. Although none is home to drop you off to the school. You can attend school by way of online or video conferencing.

Then, By way online you can attend to classes from anywhere. You can join to the class even if you go to your friends house. Also if you plan to go out the state for few days you can attend to classes from there. Students can enjoy also they can study. They're able to work in online.

In conclusion, for online or video conferencing students doesn't need to worry about there attended. Distance learning students attend classes on time by online. Distance learning students also attend to school everyday. By way online you can attend to classes from anywhere.

I think students would benefit from being able to attend classes from home.",3.5
"That some schools offer the option for students to attend classes from home by way of online or video conferencing. I think that this option is a really good idea for the students. This option can benefit many students that cannot attend schools in the regular schedule. Many students don not have the resources, time or for others personal reasons to attend schools and this option can be helpful for them to finished the studies.

Online classes. This is one of the option for those students that want finished the schools. This option can help them. They can take the classes from theirs home without go to the school and according the time that they have. Time can be a really impediment to attend school, a lot students that leave schools is because they have to work after school and they do not have enough time to do homework or other school activities. They start falling their classes and at the end they diced to leave the school and go to work. Because they may have to feed their families. Family and money can be other reason why the guys leave school some of then came here and don not have any family. so they have to studied and work at the same time to get some money to sent back to their families. But now with this option they can continue with their studies.

The other option can be the video conferences. This option also is a good idea to keep studying. Like online classes this also you can take it from your home any time that you want or depend the schedule that the teacher give you. Because on this option you are going to be taken classes in real time with teachers, that you will see each other by camera. This option can be helpful because while you are taking the class, you can talk to the teacher and ask about something that may be confuse you, and keep practice with him like you was in a school classroom.

One thing that make this great is that wile you are studying you can keep work and doing personal activities that you usually do. and the good of this program is that not only work for young people, adult also can attend this courses and finished their high school. Because other reason why people leave school is because they are over age or too old to go high school. But with this option you do not have that problem because this involve all people.

As we know in this time more and more teenagers are leaving the school. Some of then because do not have other option and others just because they are lazy. But now that the schools are providing this option many student that left school and other people can be benefit with that, and be a easy way for a lot students to finished their studies at get a better future.

I think that if more schools provide distance learning as option for the student, more people can get involve and be benefit with this program, and get better opportunities on their life. Because now that the school are doing this is not excuses to not finished the school.                      ",3.0
"Some schools offer distance learning as an option for students to attend classes from home by way of online or video conferencing. Do you think students would benefit from being able to attend classes from home? Many believe sitting in a classroom is better for students education, but others believe it more reliable for online or video conferencing. Distance learning won't give you the same benefit as sitting in a classroom. Its more reliable to sit in classroom because if not you could fail, system can shut down, and you'll be getting more physical help in a classroom.

Many like distance learning because it's more flexible, but because it's really flexible a lot of people have a higher chance at failing then passing. Imagine, a lot of people don't like waking up at six in the morning to get ready for school, so what would you expect from a student who stays home. He/she could wake up late and still miss there class which means they're missing the material and education they need. Others irresponsible students will forget about the class and they won't care on doing the work. They will have the mindset of ""it's online, i can finish it later"". Many student fail to do there work because of laziness and for being irresponsible. Especially, if the weather is nice outside many students tend to make plans and won't have the same attention towards school like before. In the other hand, if the weather nice outside and students go to school , sit in a classroom, in the afternoon they wll be able to enjoy the weather and get there work done..

Numerous of computer's systems shut down because of many different reason. If this were to happen to a distance learning student, they wouldnt be able to log in. Some systems take hours, day, and maybe even weeks to get fixed. Other computers have trouble accessing internet. Without any internet, no student will be able to do any online class or video conferencing. Another problem with computers are, that the power goes out. If you computer or any cellular device is not charged where would you be able to plug it in? How would you get your classes done? How would you turn the things you need in on time? These are a few question people dont stop and think about. Therefore, because of these troubleshooting problems it best to go in to a classroom.

All students have many different learning skills. Some prefer physical help instead of visual learning. Learning the material physically is way more reliable to learn easier and faster. Physical learning can help people get there work done faster, easier, and not get distracted by other things around them. Students can be more focused on their work and get it done on time. Others say the environment in which there in doesn't matter as long as there focued , but to other people it does matter. While students are at home they can easily get distracted and forget they have work that needs to be done. this will cuase many students to fail and would have to retake the course.

.",4.0
"Students will struggle to learn the subjects that the school requires them to take such as History, Math, Science, and English.

Attending to school can have a huge impact in your life. How would it affect you, if you don't atten to school?. would it be the same if you learn all the materials by watching videos?. would you be able to ask questions just the same way other students do?. Making a decision of taking class from home can make a huge impact in your life and the future. For example a high schooler that takes classes online that wants to be a history teacher they can struggle a lot because a video can't give you enough information, for you to know the story. a video only summarize the story comapring to when you're in class you can ask questions and also have more information from your teacher. Having a teacher explalining you everything and working with other students can help your grade and also your GPA for you to attened to good collages and be able to have a lot of advantages.

Students will have more benefits and advantages of learning the materials, if they atten to school. students will also have good grades and apportunities for them to get a scholarship and have a higher GPA that would help them attened the collage they want to go to. For example if students don't have a high GPA, the most common thing that would happen would be that they will be rejected by a lot of collages. Having a high GPA can help you get into good collages without having to pay and you can also earn money while you're attending collage. students will be able to graduate early from collage and with a really high degree that could benefit them by finding job where they start at the top like others professionals people.

Students will struggle a lot looking for collages that are not too expensive or collages that can help them save money. For example nova is an academic instutude collage that has a lot of benifits for students such as saving money for collage. Have apportunities of going to others university or instutudes where you can work as an asisting and get well paid. Nova can be very helpful institutude that students can attened to because they only attened to nova for two years. At nova they prepare students to when they are ready to move on to a four year collage but you need to have a good GPA and have all the requirements that nova asks for.

However not everyone agrees that atteneding to school is benificial for students. some students think that having to show up to school is a waste of time and that it would be better if they learn by looking tutorials on youtube or being able to attend classes from home. For example if students don't attened to school they won't be able to understand anything which it will cause them to stress out and make them give up on there dreams. students won't adchieve if we let them attend classes from home. Students also don't agree about having good grades and a good GPA. For example students think that they can still go to the collages they want to attened without matter of there grades and GPA that all they had to do is pay. but the question is ""do you have the money to pay collage?"". ",3.5
"Students would be benefit from being able to attend to classes from home because some students have to work, they have family, and others live far away.

First of all students would be benefit from being able to attend to classes from home because some have to work and they dont have time to attend to school because of their schedule.

Second reason is that students would be benefit from being able to attend to classes from home because they have family, that could be a problem for them since they could have kids and have to take care of them and being able to study from their houses it's a great a option for them.

And last reason, because others live far away. sometimes students dont have transportation because of their location or maybe they don't even have school in the area, and online classes it's an good advantage for them and good opportunity to study.

In conclusion online courses have many great opportunities and good advantage for students, and some of the reasons are: because some students have to work, they have family, and others live to far away.",3.5
