full_text,Overall
"In my opinion the attend classes from home by way of online or video conferencing is a excellent idea for everybody. We have many benefit from to being able to attend classes from home for example, we have more time for sleep and have more energy for study, also the students has more dedication, the students has more concentration for study in home because, nobody distract to the student, the students have more time for make other things like work or others pastime

Many student don't like this idea because, they think the attend classes online is so difficult but I don't think so because we have help of all teachers. One reason very important is not mess around, because take the bus for me is lose time, maybe the classes online can start early and we have more information, more experience for the future, the thing more important is learned more, in my opinion the school is a little distraction for many students because they don't pay attention to classes, they go to other places when we need study more for the life.

Another reason is beacuse is about the video conferencing this idea is great because we learned to communicate or socialite with the people in the video conferencing, I think because, some students are silent and this option help you.

For many parents I thinks is a great idea because they have more control in home like they know when the student work in classes or not, maybe the parents wanna see the progress of the children. The idea is productive, is a new experience for the students and parents. Maybe

This option for the students classes from home by way of online is in my opinion a great news because for some people stay in home and practice and study is more comfortable. Classes online is not difficult for the students because in the computer we have modules and information and others things can help you, and is more easy in video conferencing because we have always somebody who can help, we can talk with a teacher or somebody, so is a good idea and new experience.

In my conclusion I support and for me is a good idea the option to attend classes from home by way of online or video conferencing because is a new experience and i like it the idea and is more comfortable stay in home is more peace, more concentration, is more time for study and more important is learned more things, new thing for the future because the place is not important you can study in others places but the important is study more and more. Study is more important, the place is not important beacuse when the person want to be someone like a professional in the future they need study much.",3.0
"Students wouldn't benefit from attending to classes at home. Schools offer different options that distance learning does not. It's a good opportunity to attend regular classes. Everyone can learn in different ways but a better option it's by attending normal classes. People have the option to choose whith what they feel comfortable. Attending to regular classes gives the opportunity to pick their own classes. We can have many benefits by this. If students attend to regular schools they have the opportunity to meet new people, to participate at clubs and they have the chance to talk and get help from teachers.

Students who attend normal schools have the opportunity to meet new people. Not everyone likes to be anti-social and to be alone without not knowing others. Sometimes is great to have a person that we can tell everything. By going to school, we have the chance to talk to a thousand of people and to make new friends. Once Generic_Name got the options to pick home school or to attend to normal classes. She chose to do classes at home. She was happy for the idea that she has not to wake up early. For the first couple of weeks everything was fine. She was getting use to it. One day she realized that she has no friends; she feels alone. Generic_Name when to talk to her mom about the way she was feeling. Her mom told her that if she weren't pick to stay at home and doing distance learning; she weren't to feel that way. Generic_Name thought about what her mom told her and she decide that the best option was attend to normal classes at school. If we attend to regular classes, we are not going to feel alone and we can make new friends.

Schools provides the chance to participate at clubs. While distance learning don't have activities or clubs for students to do. Public schools have different kind of activities or clubs that they can enjoy. Activities and clubs are a good way to help and to prepare students for the future. They have the option to enjoy a team from their preference. For example, a person who like football. They might like to form part of the football team and that's what normal schools provides. If this person form part of a football team; he can get scholarships to participate in big leagues. From clubs students can get an idea of what career they want to get in the future, to discover new things, and to get experience from this different activities.

Other might argue that distance learning gives students time for their jobs, they can avoid being getting in trouble and they can take care of their youngest siblings while they are at home. However, people by attending to classes have the chance to get help from teachers. It's a reality that not everyone is capable to understand easily. Sometimes we need a push or help from others who knows about the things we don't. The awesome thing about normal schools is that teachers stay a little longer after school to help with hard work. To pay attention during classes can be hard because of other classmates are making noise or it's really hard to understand. Teachers talk about our grades and gives us advices to improve them. Talking to teachers helps to understand because they give us a deeply explanation.

At school people have the chance to make new friends, to have the oppoortunity to try new activities and to improve academically with the help of teachers. Some people can be in disagreement with public schools, but they have on mind that sometimes it can be a better option. School it's a good way to get out of home for at least some hours. Not everyone likes to being at home for the whole day. At school we can have fun with our friends, lunch time is unique and that is something the distance learning don't offer. Activities after school are a good way to keep people out of trouble. To help them to choose a good path. School have a variety of ways to have fun, not just by playing, also by learning. ",3.5
"I know taking online or watching video conferencing class can be relaxing sometime, and sometimes student even pray for school to be close. but that does not mean student should take online classes or watch video conferencing , It not a good idea for student to be take online classes and I am not in favor of the idea for student to take online or watch video conferencing because they can find the online teaching to be boring and it will be very hard for student to understand the teaching of the video.

Although some people might think that taking online or video conferencing class can be helpful because student can get a lot of sleep before starting the class and the student will be the one to choose the time he or she wish to take the class or watch the video conferencing.

firstly why I don't agree with the idea of taking home school or watch video conferencing is because student find home school to be boring and they can't focus in the teaching of the video conferencing. like for example if the person who is teaching in the video speaks softly it will make that student feel sleeping and by the time he or she get up the video might be finish at the end of the day the student don't gained anything from the online teaching, and other student will turn on the video and still be charting with their friends on the phone while the video is playing, he or she will not focus on the video that is teaching.

secondly why I said home schooling or video conferencing can't be beneficial for student is because student will find it very hard to understand the teaching of the video conferencing or the home schooling. like if the video is playing but the student don't understand the teaching of the video he or she can't get the chance to ask question about what they don't understand .And some of this video teaching sometime is really confusing the student that why other student prefer to set in class while teaching so that if he or she don't understand they can ask question about the topic. other student have their young ones at home while he or she want to listen to the teaching their young ones will be make noise so they can't get what the video is teaching about and that will make them not to understand the teaching.

I am not in favor of the idea of student taking online classes because they will find it very boring which they can't focus on the teaching and it will very hard for them to understand the teaching of the video.

for this way I find it very difficult for student to gained any learning from taking the online or the video conferencing class.       ",3.0
"I agree that students would benefit better on taking online classes and video conferencing at home. Most of the students prefer online classes because they can't get transportation from home to class. Video conferencing and online classes would benfit students in a way that their will be less distraction and work in your own level. Society now in days has many bullies in school that it comes to the point that studuents don't want to come to school and prefer taking class at home by there self.

For example I had a cousin that took online class at home because he had no transportation to get to school. He was able to benefit better at home because even when he was sick he would still be able to accomplish his work. Most of the teenagers want to go to school but they can't because they have no way to get to school. Online classes and Video conferencing is way were students can get education and graduate without leaving their house. My cousin got education and he graduated and he only took online classes and it helped him a lot due to not having tansportation to school.

There are many kids out in the world thet get bullied in school and they want a education but they can't due to bullys. Classes at home can benefit kids getting bullied in many ways for example,

you won't have to worry about getting bullied at home if you take classes at home, you will get less distraction, and you will work in your own level taking classes at home.

Therefore, This is why I agree that students can benefit better taking classes at home in many ways. Online classes and video conferencing may benfit some people but due to experience with family members and friends

I feel like it benfits most of teens in the world. Not all teens get to have education due to many reasons which is why I feel like it can benefit many teens in taking classes at home. ",4.0
"I think students should not be able to take classes at home. Because is not going to benefit them with their work. Sometimes students dont know how to do their assignment assigned. Students need to communicate with others to gain more experience.

a lot of students needs help with one person to support them with their work. Some students are not smart enough to work by their-self. If students take classes at home they might have some issues.

For example from my point of view I think students should come to school. Because is more helpful for them they get help from their teachers. They communicate with others share their thoughts. If their having problems with their assignment they can ask for help.

however some students are not agree to come to school because they might not like to wake up early every morning or deal with others. Some students have bad attitudes and they dont like been with others or forced to talk. But it is more important to come to school because it benefits you gain more experience.",3.0
"Being able to take online classes from home, is something that i would like for all schools to offer. Graduating high school is a need in this time and generation, for the reason being that most jobs ask for at least if you graduated high school. There is lots kids in school and not all have the time to go to school, some kids have to help there parents work for there not financially stable. I myself have gone through that where had gone to an alternative school so i could have more time to work in the day and come home to do some of my courses. Many people say education is the number one thing you should worried about and thats right, though some kids can't cause they have to help there family to provide in relation to paying some bills, put food on the table or picking up there siblings. providing school to be done at home will help the kids that have to go through all of this.

high school can be hard at times work is stressful some kids hate to having to get up early is hard for them so they miss out in some of class time. You keep missing some of class every day it can turn into hour's of class time that you missed, also can effect in the way you are learning having more time in your day to work can help you for there you are learning at your own paste, not the teachers. Some students that learn slow. takes time for them to learn one thing and by then the teacher is on the next unit there learning about. everyone has there own way that they learn better students that are fast learners wish that they can learn everything faster to get the class over with to go on to the next. those students can get classes online so they could do them at home to get the most credits they want this would also help them graduate faster.

Very few kids know what they want to work as for there career. Doing online classes can help these students graduate earlier to go the school they want to go to, or there career they want to lean on. This can help these students out in many ways. Going into a career path the earliest you can is a great thing you can get more time to learn and get good at to what you want to be doing like working become a master tech the younger you are the more experience you could have when you get older. The more chances you can get to become the best master tech at your location. Many students in high school learn in there own way also are smart in there own way graduating early can help students to become what they want to be the most.                           ",3.0
"We will not be benefice of taking classes online and the reasons can be for slow internet, get distracted and not having time.

There is a bounch of students that have problems with slow internet, some times the internet doesn't

load the wed pages and with slow internet we can not due our online classes. One time i was with my friend in his home and he was taking his class online like every day and then the internet when down and he did not finish his class online and the internet didn't work until the next day.

Most of the time we get distracted at home, for reasons that are not even important at all like we wan to eat, our parents need help and they call us and we need to use the restroom every time and those reasons can be a big issue for people who take classes online.When i was in LOCATION_NAME i took some classes online, it was my first class and my uncle did not know what i was doing classes online and he call me more then 3 times and because i was using my headphones and i did not ear when he call me the 3 times he get mad, he disconnect the computer and the computer shot down, i did not finish the class beacuse of my auncle and the teacher tell me that i was so disrespectfull to her and she didn't wan to give me classes again.

One of the most common problem is the student don't have time for example we have jobs and we don't have time for classes online. Some of the students are in club or they go to church, they also take care of there little brothers, with these reasons is why taking classes at home is not a really good idea.

Do you really thing that taking classes online can benefit student? Issues can occur, when we are doing the classes online from problems of slow WI-FI and also problems or differences with family that may affect us in our concetration with the classes, that's why i don't agree of having classes online.        ",3.0
"My friend is home schooled because she use to get bullied a lot so she wanted to drop out, she could'nt deal with it anymore. Her counselor gave her a better option taking online classes because she had very good grades and she wanted her to graduate and have a good future. In some schools they offer distant learning as an option for students to attend classes from home by way of online or video conferencing. I think getting home schooled is a good benefit for students who have situations at school, for student drop outs, and it's easier and quicker.

The primary reason on why it's a good benefit, it's that it helps you if you have bad situations at school such as you always get into fights with other students, you are getting harassed or bullied, you have problems with your teachers, or you think you're wasting your time and you could be working and getting money. Having online classes can help you stay out of trouble or helps you stop what ever you are dealing with. Not only it stops the situation but can help you improve and graduating with no problem. If you are having problems talk to your counselor and ask for a possibility for online classes or your parents if you can get home schooled.

Secondly, it benefits the students who are dropping out of school. Most of the students who are dropping out are for financial reasons like, they want to help there family so, they drop out and start working or some teens get pregnant at a young age and there parents most likely they dont support them or help them in anything that they need so, it causes them to drop out. It helps them further there knowledge and can possibly get a better job. It makes them feel happy knowing they can finish school because they know they already making a decision by dropping out but they can still graduate by taking online classes. I remember when i was at student counseling aide and one day a student came to ask me where should he leave his laptop because he was planning to drop out, he looked upset. Generic_Name ask him why? he answered ""i wanna help my family out they dont have any money right now"" she gave him an option for online classes he didnt know it was possible to do that and It made him happy.

Finally, getting home schooled is easier and quicker. You can take your classes when ever you are free. If you need to take a break, you can and continue when ever you are ready. it's non-stressful comparing to regular school. Its proven that getting home schooled its less stressful than regular school. Generic_Name is a science teacher at SCHOOL_NAME he said ""88% students are stressed about school because of homework and not having to finish assignments on time"". He also said ""only 5% are stressed when they are home schooled"". In conclusion, it's less stressful and help you feel non-pressured while you are taking your online classes. It also, gives you free time and gives you advantage to do what ever you like. You get to be home and relax wake up when ever you like to, do your classes take brakes if you would like to, too me it sounds amazing!

Some people might say that getting home schooled is bad because if you have any questions you dont have a teacher to ask or a physical teacher to help you understand the topic you are learning about but it's a one on one class. There's no students just you and your instructor, it helps you focus which i personally think it will help you more comparing sitting in a class room with your friends not paying attention, playing around or not getting work done. I think it's a good benefit having online classes because it helps with people who have bad situations at school, people who are planning to drop out and its a fast and easier way to get your classes done.",4.0
"Many will say that distance learning is a really good option for students. Several students will benefit from distance learning by having better attendance, less problems , and it will also help students with certain disabilities or health problems . On the other hand , some will disagree by saying that if students dont attend actual school they will become lazy and irresponsible. Distance learning will benefit many student and also school.

Distance learning will benefit students in many ways such as better attendance . If students are allowed to attend school while at home it will give them less chances of not attending. Something that students hate most is waking up in the morning to get ready for school. Having to wake up so early in the morning just to attend school for about eight hours will cause a student to become lazy and tired.

Unfortunately some student are born or are diagnosed a certain disability to where they cant attend school . However those students with disabilities have a right to have an education. Distance learning will really benefit those students by allowing them to attend school from home. There are many reasons why students benefit from distance learning but being able to help a child with a disability on their education is the most important reason.

If students dont attend their actual school there will be less problems. Some students are treated really bad in school , many are bullied , and also many like to be drama queens . However if students attend school at home it will benefit a child because they wont have to see other students and there will be less drama and more education. Schools will stop having so many bullying problems.

On the other hand many will disagree and say that if students stay at home and pursue their education there they will become irresponsible and lazy. Students should be allowed to attend school how they want to . If a students becomes lazy because of distance learning the problem is within the student. Many will agree that it will make a student less lazy and more responsible. ",4.0
"Students have to attend school to learn more efficiently, but long distance learning is not good because you have to take your own notes online ,however, if you were to attend school on regular time, you would not have to worry about taking your own notes. Although, online is still a option because you just need a computer or a laptop to take online classes, and not having to worry about missing the class when the teacher took notes that day. All you have to do for online school or video conferencing is get online and do all your classes, and not worry about getting to school. Students need to go to school instead of online or video conferences to learn more and participate in class or school.

Going to school than taking online classes or video conference is way better because you go to school and actually pay attention and not get distracted of what is around you in school ,however, taking online classes can get you easily distracted when you're at home or a public place trying to do you work and you hear people talking and having conversations all around you. While you're in school you can peacefully finish all your work in class and ask for a question, or even help from the teacher, but if you're taking online classes your only source is most likely going to be a online source, or the guides they give you online which might not be always correct. The information online could be outdated. while the information at school is planned out and ready to be given out by the teacher or staff at school. Even though, everyone would prefer online classes over actually going to school, people should consider going to school for a backup just in case the people taking online classes don't like how it is done. Going to school and learning just for being in class helps you in a lot of ways such as visually, speaking, and self control, however, if you're at home taking online classes it will only help on your visual learning.

Taking online classes can probably be difficult sometimes, because people can forget to take the class the day you need to log in ,however, going to school and knowing which days to go to school is very helpful because you can learn without any problems happening. Although taking classes online and not having to go anywhere and stay where you are is good, you're putting your grades at risk, the computer can malfunction or even be corrupted with a virus on it, and it can slow down your computer or even shut it off every time you need to do your work. This is why going to school is more efficient. The people that go to school have no worries just bring all the materials they need for class and work and pay attention. Also students can have more time to work and can be actively speaking with our teachers too, for questinos and answers to help students. Students need to go to school instead of online or video conferences to learn more and participate in class or school.",3.5
