full_text,Overall
"I think that students would benefit from learning at home,because they wont have to change and get up early in the morning to shower and do there hair. taking only classes helps them because at there house they'll be pay more attention. they will be comfortable at home.

The hardest part of school is getting ready. you wake up go brush your teeth and go to your closet and look at your cloths. after you think you picked a outfit u go look in the mirror and youll either not like it or you look and see a stain. Then you'll have to change. with the online classes you can wear anything and stay home and you wont need to stress about what to wear.

most students usually take showers before school. they either take it before they sleep or when they wake up. some students do both to smell good. that causes them do miss the bus and effects on there lesson time cause they come late to school. when u have online classes u wont need to miss lessons cause you can get everything set up and go take a shower and when u get out your ready to go.

when your home your comfortable and you pay attention. it gives then an advantage to be smarter and even pass there classmates on class work. public schools are difficult even if you try. some teacher dont know how to teach it in then way that students understand it. that causes students to fail and they may repeat the class.              ",3.5
"Although some say students will not be benefit of attend classes from home by way of online or video conferencing because a lot of students don't have access to internet or they have no computers at home, actually some people say students will be benefit to attend classes from home because it will save students time and it will develop students confidence on technology.

Some say students will not be benefit of attend classes from home by way of online or video conferencing because a lot of students don't have access to internet or they have no computers at home.

It has been prove by the National Family association that 45% of all the students don't have access to computers or other electronic devices.

Cost of computers is higher for the lower class families.

Some people say students will be benefit to attend classes from home because it will save students time.

statement by the president of the National Education.

Time students save by going to the school will be use to learn more from home.

Some people say students will be benefit to attend classes from home because it will develop students increase confidence on technology.

Technology is the future that help students become brighter and creative.

Helps develop the learning process.

Although some say students will not be benefit of attend classes from home by way of online or video conferencing because a lot of students don't have access to internet or they have no computers at home, actually some people say students will be benefit to attend classes from home because it will save students time and it will develop students confidence on technology.

Finally, we should encourage students to attend classes from home because it will save students time and also it will develop students increase confidence on technology and other learning areas.",3.0
"They are some Schools offer for Students to Lerning as option for Students from home. They are many thinks you can't Lerning at home you can use by way of video or online.

First, Know in this world the technolgy availadle everywhere and you can use anytime you want to go online and attend the classes on the time.

Secand, They are many student they have a lot of job or they have baby's or anything, They can't go to schools to lerning. So, they should take classes by way of online or video they can open the classes on the job or at home.

Thrid, The student should behefit from deing and serios to do the work and homewark from home because this is nice from them they make it for you easy to learning evry thing on the time.

Last, If you want to learn or take any thing in this life you can do any time you want and anywhere, You can take many classes at home, and finsh you'r education. The Schools are the Bast houes in the world.",2.0
"Students can benefit from this option, but also can affect them in different ways. Many students have difficulty coming to school every single day. One impediment may be transportation, a lot of them do not know how to drive, so they can not drive to school. Some students live in areas where the buses can't enter. Many of them walk to get to school every day or ride a bicycle. They face many problems but the biggest one is weather. The climate can change quickly, when is raining a lot or is cold these students stay at home, because there is no way how they can get to school.

Students can benefit by not attending everyday to school. For students who live far away from school is a great option, because they safe time and also they can work during the day. As we see many students have a job after school, and this is hard for them because they have to be active in school. There is a big problem because they come tired to school, and you see them sleeping in classes. They can not be concentrate because they do not have time to sleep. Many of them do not have time to do homework, or different projects they have to complete.

It is a great option to have schools that offers distance learning. This action help many students but also can affect them. In my opinion when you attended to school everyday you can learn more. Because you have all the resources you need to understand, and complete the assignments. But students who like to work hard and take their time to studying in their houses, it can also be easy for them.

Before that there was not technology is was extremely hard. Now that the science had grown up, and the technology appear, we have a way more opportunity to do many things. One opportunity is to studying online from our houses. As I said now that we have technology, we have more opportunities and is really easy to find stuff that you need to learn in your school.

In my conclusion, I think is good for our society having those school who offers distance learning. Because many students can not be in school everyday, and this action help them to keep studying. If this program does not exist many of them could never go again to school, because of all the impediments they have to attend school, and they will never accomplish their dreams. ",4.0
"The new generation of students decide to take their classes in online. Although if the students take classes in online they might allow to finish high school in a short time,also they might be safe at home, they can take more free time to work or enjoy with their family, and graduate as soon as possible and start the college.

Even thought some people might say students shouldn't take classes in online because they can not learn good enough, they might be distracted or even ask any question to solve their problem, regular high school have different program to help students to be successful on their grades. In this case students need to talk with any consular or teacher in school to give some advantage and disadvantage about online class, student might need to know their benefits on what they going to do for their own good. Most people care about education, students need put some interest.

concluding with this state argument student should take any classes in online because they don't put much interest to learn any assignment, students might need to attendance to a regular high school to learn and have better apprenticeship, and abilities for their accomplishment, students in high school are more successful, they have good opportunities to get in the best colleges. Nowadays teenagers are more focus in having fun, some of them do not know that education is very important, if we want to have a good job and better future, every child need education first, but students are following good rulers.

according to this argument I have this experience my brother want to take his classes in online because he does not want to come to the school, i still in a normal high school almost at the end of the first quarter and my brother still waiting a call for his classes. He said it was his best choice but in my opinion that was not a good idea because if come to the school i learn and understand my classes, when a teacher is explaining and helping me to do my problem i feel more exciting about it. I want to be a great student and learn everything instead of be at home waiting for an acceptation for classes.

concluding with my argument students would not benefit to attend classes in online, attending to the school is more important and benefit, they take serious their resposabilities in everything,they became more measure,classes in online never going to be same as the regular school, students never are going to learn very well, teeneger really need to attendance the school for a better education.                                                                                                                                                                                                                                                                                                                                                                                                                                                                                                                                                                                                                                                                                                                                                                                                                                                                                                                                                                                                                                                                                                                                                                                                                                                                                                                      ",2.5
"Distance learning can be very helpful to students who cannot attend classes at school like other students. Although distance learning can effect students losing focuses in their classes, nevertheless, learning away from school can help us the students to have less stress, and giving us an opportunity to take care of our brothers and sisters and attending classes without skipping classes.

Almost everyone in school is stressing about something,so attending classes online would help a lot. For example: It gives us more time to finish our work for other class and stress less, because to me having the advantage to attend online classes would help out a lot, and also i might have other classes to worry about. so having an option for us the students to attend class from home by using online or video conferencing might not sound the worst. And could help students who are suffering from anxiety and having any type of stress. By using online classes they could listen to music to clam themselves down and not having any signs of a panic attack, because in school not every class or teachers might let the students use their phone to listen to music; they might not be able to know if the student is having a panic attack, but at home if they are attending classes online and having a panic attack their parents would be there to help them clam down.

Most students need to stay home in order to help with family emergence. Research has show that almost 50% of the time if the student is not at school, then they are at home helping out with their siblings at home, doing that they skipping school and losing an education, but with online classes they can do both without skipping class or missing anything in school. Because with online class the information they need would be provided to them, if they have a laptop or computer and in case they do not have any of these technology they can just go to their local Library with their siblings and do their assessments with no worries, because their siblings would find some kind of fun to do at the library.

In conclusion attending classes online at home would benefit a lot for us the students because in case some thing happens at home they just go online at do their work without stress about losing points, to me personal attending classes online would be very helpful because I would have to stress a lot, can skip school and get some sleep.     ",3.0
"Should students have the option to take online classes? Yes, I believe that students should have the opinion to take those online classes and that no one should take those classes away from those students. Students can be more active when they are at home then at school. You can pick a time to start your online classes and have a fixed schedule. It is important for students to have the education of there own way instead of worrying about how public/private schools are run.

Most students attend to focus more when they are taking online classes; For an example, Students dont have to worry about how teachers are teaching students when they are in a class full of other students. Students tend to struggle when teachers aren't teaching their students properly and care more about there monthly payments. Second example, is that having that one-on-one connection. Having that bond with your teachers are great ways to not be afraid to ask question when you dont get a problem or how to get the answers to the homework. Third example, most students tend to be antisocial at school because thats how they were born or even scared that people around them with judge the student and that the students wanna feel safe at school.

My second argument is that students tend to get bullied at school; Bullying is a huge thing around the world and that bullying is a serious problem; Bullying is the number one cause of student not attending to school and not getting the proper education they need: For an example, when the student is taking an online class, they dont have to worry about other students picking on him, but instead he can feel safe and really enjoy the education that he is learning online at home. There was this one time that one of my really close friends was being made fun of and picking on him everyday at school. He would sometimes not attend to school because he was too scared to come in to class and would always worry about the other students. He would not focus on his school work, but would mostly focus about protecting himself.

My Third argument is that students can ask question when they are having that one-on-one with the teacher. Students are afraid to ask a not so good questions in math, English, history, etc. Students have that nerve racking moment when a teacher tells the class if they have any questions. There was this one time that a teacher asked the class if there were any questions and none of the students raised their hands because I felt like everyone knew what they were doing in the class but me. I was having that moment that I didn't wanna waste the other students time about my question that I didn't understand on. It was the judgment that they would give me, but I know that it wasn't the case, people tend to over think about the problem inside the classrooms. For an example, Extroverts tend to not talk/socialized to people often, instead they don't talk to others and the problem that they are having trouble with and scared to ask the teacher because they feel insecure about talking or feel uncomfortable talking to others.

In conclusion, Students should have the option to take an online class and enjoy learning like everyone else should. Learning is a fun thing to do, but have different learning styles in life. The world keeps changing everyday now and new technology is developing overtime.",3.5
"No,I dont think students should attend online classes from home. Because online classes might be sometimes harder for them to understand and to get help. It is always better to take classes in the person so students can learn better and get more experience and they can easily get help from the teachers whenever they want to. Online classes make people lazy and dont went them to do anything. They should get experience of going to school so they can learn more better. In my opinion in person classes are way better than the online classes. And it help students to be on time always.

Students should take the classes in person so they can attend school daily and get more active. It is totally different experience by taking classes online or in person beacuse sometimes its hard to understand from the online classes and students cant get it. Online classes are good for the students who need to graduate early and they cant have more in person classes so they can take the classes online and graduate on time. online classes make students lazy and dont they dont do it on time and they get lazy by staying at home. Online classes might be harder sometimes than the in person classes. Some people are used to online classes because they feel they are more easier for them. online classes are good for students who want to complete their all the required credits. Some people dont get time to do the online classes beacuse they have to go to work and they cant able to finish everything on time. They put more effort by going to school and sometimes they just dont feel like doing to online class. Online classes are good for those who wants to complete there courses early. Students should attend school so they learn more better. Sometimes online classes might be pressure for some students because its alot of them to do it and it depends on them whenever they want to do it and they should finish before the end of the school year and itmight be more stressful for them to complete everything soon. They should try there best to attened school beacuse it is more better than doing the online classes.

Online classes make some people lazy and they dont get experience of going to school. They should go to school and attend the classes so they can do all there work in class and get help from teachers whenever they feel difficulty beacuse getting help from online classes are harder it is a bit harder to get help from internet because some people dont understand them and it is more easier when they get help in person and they can understand everything easily and ask questions whenever they would like to. While,Some people might say yes it is better to attend online classes rather than going to school because they have to work in the morning and they dont get time to come to attend in person classes because they dont feel like going to attened them so they attend them at home. Students dont get much things in online classes and the feel difficulty sometimes and its hard for them to get some help from someone. Becasue if they go to in school classes they can get more help and they can get help for them to go to college. They can ask their counselour about how to apply for the colleges they want to get admission. They can get know whats going on in school and they can attend many activites in school and take some electives classes so they can learn more. Some people just want to take the classes online becasue they dont have the time to go to school.

Some students attend both online and in person classes beacuse they cant get enough classes at school in a year and they want to graduate on time so they take online classes so they can finish everything on time. It is little harder to attend both at a time beacuse they had to go to work too and they dont get time to do online classes. One of my friend jose he had done the same. He had to graduate on the same year but he was missing one class and he was not able to graduate on the same year so he went to his conseolur and he asked him what can he do to graduate on the same year so she gave him the idea for the online class and he started doing it. He felt it little harder but he was able to finish on time and he was able to graduate on time. Some students are always late on doing on online classes because they dont have enought time to do it If students get to in schools they get to know more about school and be more responsibility and they can get more education so they dont feel difficulty when they go to college they should always have experience of high school so they dont have any problem in college later on. And students put more effort in class because they have to get good grades so they can get good GPA and easily get admission in the college they want to. Online classes are sometimes harder depends on what class are they taking. Maths class might be harder to do in online classes beacuse you always need someone to help you because you might have so many questions and it will be harder to do maths in computer.

In conclusion,I would say it is better to take classes in school so students can learn more better and its more easier for them. In person classes are always better and students can get more help and understand better. Students can take part in activites. Students get more active by coming regularly to school. By coming to school daily it helps students to learn more and they get good experience for coming to school by making new friends and getting to know more about school. And they wont feel any difficulty beacuse there will be someone who can help them whenever they want to. By taking online classes students dont learn more like they can can learn in school classes. Students should take the online classes only if it is needed them to complete all required credits they want to graduate. Online classes might help some people and they feel more comfotable. But in my opinion i would rather take in school classes because it would help me in future by getting good experience of highschool and learn more",4.0
"If you image the world student stay home take online class? that be great for student are most sake can not go to school but online class is big help for sake or in the hospital. they are people hoe have problem like have cancers or harder dazes is not harm full anyone student in school. but some student they say their is no problem to not to come school if you sake or not you have come to school. but they are range because they do not hate to go school they body is not strong handily jar mes in and get sake al the time and school allowing ha very to can take online class but they have pay. but student way not free because student hoe are sake pay all the class and they can not play any sport, your student can come to great full of your parent.

do have thing in their power sand ache one to school .

very I was 5 year old choke cold toke my my parent,

I do not wont to go school star cry Generic_Name hurt van my gram father hired what i say come to and say stop cry eat your maidens and go to school way do not wont go school to day then and gram father told me a story van gram father was younger he told me van he in school they wore no online class and they some people van can go to because my gram father harder and harder and that but still he harder to bake a doter. then in end i go to school think what my gram father la cone he throne me

THINK ABOUT

it was long time age now my 18,

I great full my gram father what he.

Teacher me non

I realize what he mate education is harder get stay home ,Wii not give anteing in end it does not batter if you take online class or not you take normal class if you but some time think way you come fun or wife, friend you are not think if online class doing wok get machine you do it later you not think about what is amount in the end they two lines to go can to light or dark that you live some one think they family and they love and wont bake something that make they family prod and go to collage live a happy live with family.",1.5
"I think that the online or video coferencing wounld not benefit high school student because they many pros and con. pros student can work on thier own sudent can work on home cons

Not all student have a acces to the internet student cannot understand the assessment it make it not English speaker to understand student cannot benefit for attend classes from house. because take classes from home cannot improve the student educated. In the school class student are alllow to work with group and work with teacher. home school can cause distraction, worries. For Example when you're work or take exam and your family member call you to do something for her. in school they taught you many thing to learn. Online classes and school classes have similarity and different thing in common

The First different between this two classes is that online classes are classes that you take home why school classes are classes that you take in school.

The second different between this two classes is that in online class you don't learn lots of thing. but in school classes you learn of thing. This are the similarity between two classes.

The first similarity between two class is that both classes are required the second similarity between two class is that both classes are teaches by teacher  ",2.0
