full_text,Overall
"_Yes i think yes its can by a benefit to attend classes from home because many students come late in the school and the teachers sometimes they mark they students are absents or late, but may the school can give the opportunity to who work or to who need it because many student we are working in at the night and sometimes we see many of they students sleep in classes.

_But if we attend classes from home that will by better because we will sleep more time at home and we will don't come at the school every day or wake up the same time all day, but the teachers will by attent for their students who has take their classes from home to send their work or to help they students when they don't understand or sometimes we stock to do or how to do and then the teachers will by help.

_But is a bad idea to because many students are may don't wants to doing all they work at home because they knowing they are home and when we are home we prefer doing others things except the school work and that can by a problem when we take the test because many students can fail their test, because in home we can find the answers in internet or anywhere but when we are in the school every day we can't use our phone or anything to find the answers because the teachers wants to test us what are we know or what we are need to know to by better and to resolve all you'r work in you'r own idea may the teaher can give you some ideas or examples or explain how you can do it but is diferent like when you finding the answer in internet because the internet can give you all the answer and yuo will be no learn nothing because it's just copy what are you see except with the teachers you learn more because they tell to you to try to do it in your own and you have an idea to what are you going to do.

_And it can by hard for the students to graduate because can affect they attend in the school and will many students going to skiping because they can come in the school but they can leave early because they can find a excuse to to leave and to do the attendece at home or just skiping classes and don't doing nothing. Well it okay to come in the school every day because if one has attend in home then all students wasts to have attend at home ",3.0
"Student who live far or have a hard time learning will not help them succeed with there classes Teachers are feeling worried about there Student and they try everything to help. So the Teacher report to the Principal and notice the score are very low. They have to find a way to make there student successful, so they had a meeting and suggest that Student should do there assignment at home they called Home School.

Home school is a program to allow Student to do there homework, quizzes, assignments, and tests. This program help the Student to become successful, Student give there thought about home school and they say is more easy then School. What good about home School that you can stay at Home, eat your lunch watch T.V, and you will still have time to do your assignment on time.

But some other Student didn't want to be home school because they feel them self bored in home. They don't get to make friends, they need help with their assignments, They won't get the information they need. Student often get Home School because they probably don't have schools in there location but Parents want the best for there kids to have a good education so they gotta do whatever it takes to have there kids to become successful in the future.

If I was in the position or suggestion on the issue I would let the Student know to should take regular school. Because you will have better chances to succeed better then home school you will still have your friend in fact they can even help you with your assignments, even better chances to get to college with Teacher help you will know more information to be ready in the future. Student still suggest to be in Home School Because is still a good program to in to help be successful but not in the future People should take School more seriously if they want the better chance.",3.0
"students who take an online classes do not have much benefits because, they feel lazy to study on their own, sometimes do not their assignments and also do not have people they will be compete with. They also do not have much confident to speak with lots of people or give a speech in front of many people, which makes someone who attends an everyday class with a lot of people to be experienced than a person who takes an online class. people with much experience in a lot of things do not always have fake people in their lives.

People always think that taking an online class is very good, which is totally wrong. When taking online classes you do not get to know the people who are performing much better than you in class, but when you go to an everyday class in a school, you know the people who are better than you in different subjects. When you take an online class you do not get people who will help you solve your problems in much courses; for example, when you take an online class and you fail in a subject you would not know those who performed good in that subject, that means that you will not know how to study hard to perform good next time. Online students always find it difficult to study because, they do not see their mates in school learning which will also encourage them to that same thing. This means that taking an online classes will not be advisable for students.

Also when taking an online class, you do not get to interact with different kind of people through out the world. People who take an online class do not always have the confident to speak in public and do not always have lot of friends. Having friends is one of the important things in our life. When you have friends you share each others problems and solve it together. This means that when you take an online class you do not always have enough friends to speak to or to share your problems with. For instance,when you are given the opportunity to give a speech in front of a lot of people, you begin to shiver or start stammering because you are not use to speaking in public. but when a person who attends classes which involves a lot of individuals, they always have the confident not to only speak in front of their mates but to also speak to those who are much older than them without any fears.

Moreover, people who always involve themselves in a video conference do not always know the people their dealing with in their business or do not always have much idea about their business meeting. When one is present at work place all the time, he or she runs the business smoothly without any misunderstanding with anybody. Again when having a business with someone on a video conference, you do not know if the person you are dealing with is a fraud a fraud or not. So people who do an online businesses always end up putting themselves into trouble. When one is always present at their business places, they always know the people who are hard working and can make the business go much further and those who are lazy. When you are always at your work place,you make your members to respect and adopt your policies.

People who take online classes do not understand much better because, the teacher is not always around them when they need help with the topic that they not understand. But hen you are in an everyday school classes, when a teacher always teach and you do not understand you always know where to locate him to ask for help. Even when the teacher is not around, you can find different teachers who also teaches that subject and they will always find a solution to your problem. So students who attend an everyday classes perform much better than those who take an online classes.

All the above mentioned, which includes, it makes them interact with different people, find a lot of friends, get to know good people in a business, ask teachers for help when they have a problem really shows that taking an online class or a video conference is not really beneficial for an individual. Once all these measures are taken into consideration, people will see that going to an everyday class or making yourself present at a business meeting is more important to a person.",4.0
"some student offer distance learning as an option for student to attend classes from homr by wat of online pr video conferencing. i think student would benefit form being able to attend classesfrom home. you are authorized take the electronic version of this you will taking this promptsome student offer distance learning as an option for student to attend classes from homr by wat of online pr video conferencing. some student offer distance learning as an option for student to attend classes from homr by wat of online pr video conferencing. some student offer distance learning as an option.

online pr video conferencing. the right view the prompt and teh checklist for writers vvsome student offer distance learning as an option for student to attend classes from homr by wat of online pr video conferencing. some student offer distance learning as an option for student to attend classes from homr by wat of online pr video conferencing. some student offer distance learning as an option for student to attend classes from homr by wat of online pr video conferencing. some student offer distance learning as an option for student to attend classes from homr by wat of online pr video conferencing. some student offer distance learning as an option for student to attend classes from homr by wat of online pr video conferencing. some student offer distance learning as an option for student to attend classes from homr by wat of online pr video conferencing. some student offer distance learning as an option for student.",1.0
"some school offer distance learning as an option from students to attend classes from home by way of online or video conferencing. and my opinion the student would benefit from being able to attend classes from home; the student have more freedom of concentrate in the home, student have problem for go to the school or the is student is sick of a illness and have more responsibility in the school or classes, home and job.

First, the student have more freedom of concentrate in the home that school because student not have noisy peoples, student work more quickly and have interests in the class. The corporation a student of regular school and home student, in the regular school have lass time in the class and home have more time and focus in the class.

Second, some student cannot go to the school for problem in the health or is sick of a illness. Today al the peoples can student and learn for class online or video conferencing, student with problem can learn and study like other student from regular school.

Finally, other people have responsibility in the class like the job because some not have time for go to the school and work all the day and only have time after work in the night. The person can study all the night for online or video conferencing. The principal parts of the online is you can study any day or time.

in conclusion the student can take class for online or video conferencing in the home because today the technology have a good benefit in the peoples. student can study and learn in the home in any moment or day, have more concentration, focus, responsibility and the person have problem of health can study and learn of your home.                                                   ",3.0
"I don't think students would benefit from being able to attend classes from home. Because when students coming home, they need to do the homework first. Maybe that's day some people have a lot of homework so they couldn't attend classes from home by way of online or video conferencing. If they could open some video of online then I think some students can''t watching whole video. Because when I finish my homework, I feeling so tired and I just want go to my bedroom or play game, message, Facebook, ... I guess that's habit all students because almost students doesn't wanna be work too much and parent will be for son or daughter spend time for favorite like soccer, bamboo, ukulele, ... If the students might relaxing then I think they will learning better and faster.

Some parent want my son or daughter go to the bedroom early. Because parent can control them easy, example like some students will say I still do home work on the Laptop, but they playing game with friends. The best way is for students go to sleep early. If your might for students sleep early, It really good for eyes and healthy because one young people can sleeping enough eight our every night, you can feel comfortable for star learning better new day. And if you don't sleeping enough, you can't learning anything at school because you always sleeping in classes and teachers always say ''wake up, wake up''. It not good for you and teachers. And when you go home, time for sleep but you don't feel sleep because you sleeping in classes too much. That's why you don't feel want to sleep, and today to tomorrow to whole life, you still don't want to sleep early. Maybe that will be become the cycle in your bad life, If you don't wanna change your style.

I think students would benefit from being able to attend classes from home is not good. Because when parents coming home, they need talking, do something or have a dinner with family. It's will be better you do a lot homework. If you have dinner every night, you will have a lot of conversation with your wife or daughter, Since you will be know what your family want and your sentiment with family will be better and better.

When students learning online or video at home, maybe they don't understand what video say and if they have a question, what teachers they will ask ? And if everybody have a question to asked teachers, the teachers can't responded the question too much for students. If students waiting for tomorrow go to school, maybe students will be forgot the question they want ask right now.

I think students need learning at school better learning at home. Because one people one idea, that's mean have a lot of answers your guess and you will be know the best the answers from teacher. It'll be helping you how to do work team. Work team so important with students because in your future, labor need you know how to work together. If you know how to work, you will be become the manager or boss. If I work with teachers, maybe I will better for my way.",3.0
"I agree because this can help some student, for example some student have diffulty for to learning, maybe more activity can help the student, i gonna go give to you my example.

im brazilian and i see many videos for to learing more my ingles and this help me so much, i have class in the school but i study in my house, i know many people that learning ingles in the home.

i have a friend from brazil him never go to the school in the america and him work to translator and him to receive 1.000 dolares for week, him to learning ingles study in home, whating videos and practice study the ingles online have people can to learning history,math science and other online, i make duoling, this is a game online and i learning some words to play online in my house.

Some people can not like this idea because some people this not help they , maybe they student no leaening online or whating the videos .

i think this can help they because we need to try new things for make different this in the school, maybe make cool activity.

my friend its nspire me the want to study in my home because i want being architect but i need to strain.

some people need to try new things, becase if we no try new things we can not know to leave they try, because the life its feat of new experiment.",2.0
"Some people say that students are better off attending classes online, mostly because they can feel a sense of comfort and no worries of school tardiness. I say that it's better to not attend distant classes and attend them from the school itself.

Students are better off attending classes from the actual school because students tend to have more concentration while actually attending the class. When attending the class from home, students will be more concentrated on their home atmosphere, or what happens at home. Concentrating onto something usually comes from the atmosphere you are in. Attend your classes are better and more effective when the person is alerted or more attentive to their classes or courses.

Moreover, students will develop social communication when interacting with other students. Social communication is important because not only will you get to know the other person's side of knowledge, but you can get experience from the other person that could benefit or impact your way of making desicions in your life. Students will be more of an introvert if attend classes from home or distant classes. In this way, students will definitely develop working skills when they start having a job as an older person.

However, even if they won't be able to go through or worry about tardiness if taking distant classes, going to school knowing that there is tardiness, will prepare them for the future when running to work and making it on time. Making to school or work on time depends on how the individual is smart enough to manage their own time wisely.

In conclusion, the more preferable method for students is coming to school or the class session wherever it's taking place. In this way, students develop better communication, better concentration and develop time management. Students will become better individuals. ",4.0
"A topic that is debated is if students should do online classes. Some people believe that there should be online classes. They believe that there should be online classes because the students can take there time and feel comfortable where they are . I belive that we shouldn't have online classes because student can ask for help when they need it, Students are better when they work together as a team and you can get extra help after school and before school .

Students can ask for help. Teacher can help students when they don't understand something instead of trying to look it up on the internet .Students don't learn from the internet or they will just forget. Online classes is good but what if the students doesn't understand then they would just stay confused. The teacher can show them in person then in a computer screen. If students did online classes what if they don't understand there work because they can't just call there teacher sometimes they don't answer.

Students work better when they work together. Group projects can help them in the future when they got to work with other people. They can learn from each other and there mistakes . When the students are in groups they don't do it solo and they can get the more work done. They get to meet new people that they never ever get to talk to and make new friends. Online classes you just listen to the teacher and ask question do the same thing but can never work with other people.

There extra help after and before school. Online classes there no before or after school it just the time of your classes. In School the teacher stay after or come before school to help students with their work or the ones that just doesn't understand . The Teacher helps them with homework so they don't have to do it at home and the same with classwork if they don't get it done there after school. There also people who have to do stuff after school so there is before school where they can come early and do there workk.

I believe that we shouln't have Online classes because student can ask question,student have more fun doing group activity and if the students need help they have after and before school to get extra help.

Online classes isn't really necessary it wouldn't effect anything.

Teacher are more helpful then computer.                                         ",3.0
"I agree that students would benefit from being able to attend classes from home.My friend, PROEPR_NAME attend to school she has two jobs, but in the last few months she does not attend to classes because she works too much that is hurt herself , but she does not have any other option PROPER_NAME, is independent.

However some students work to help with pay the rent, pay bills I know some students that would like to attend to school, but the do not have the opportunity for some reason .For example does not have enough time, or falling sleep every time that try to weak up to go to school is not easy work and study every day that is brave.

The idea here is to support teenagers to prepare for the future

someone will be the next president of the United States, or a professional doctor that will help many people from many countries.We can help our teenagers for a better future as school is our responsibility to work with them.

In conclusion students,

Should have the opportunity to attend classes from home and work as the same time to help their parents and the most important prepare for the future. ",3.0
"Over ten precent of the students say that they would rather go to school instead of staying home. It would benefit the students learning abilites because some teachers will teach differently then other teachers. It is so much easier learning at school because the teachers at school know what the students needs to learn. The students needs someone who knows how to teach and has been teaching for a while. If the students pick online learnig the teachers can be fake a pretend to teach the kids when they do not know anything. The video conferencing can get messed up by the internet because some people might have slow connection or no connection at all.

It would be easier for students because they will learn more at school then the video chat, or from online. Some students have a slower learning abilities then others. The students are learning by one teacher from the video chat some students will be done much quicker then the other students. At school th teachers wait for the other students finish then they let the rest of class to do other work. It will not help the students to learn from home because at home is where they have their games tv all of that stuff they will pretend to be doing work, but actually they will be doing other adn stuff and they will tell the teachers that they already finished the work.

Students needs someone who has a degree in teaching. It will be easier for the teachers because they will know what things they have to teach to the certain type of students. They would know how to teach it to them and it will be easier for them to learn the topic. It is easier to go to school becuase we will learn the topic with other students and students can ask for help from their friends or the the teachers in class.

The teachers on video chat can be a random person off the streets and teach the student the wrong infomation. Also it will cost a lot of money for the students learn from a video chat. Schools are free, so the students can go there and get education for free, nor the students, or parents have to pay. Some parents, nor students can afford online classes because it costs like over one hundred dollars.

Staying home and doing online classes is fun because we are able to stay in our night clothes and do school work. Students can get their blankets and anything they want and do work while being comfortable. The students do not have to get up and go to school. They can get up at anytime and do class work. As fun as that sounds some students will not be able to meet their friends because their friends might have a different sechdules then their other friends. They will have to do work wilhile they want to meet up.

Students should not do online classes because it will intefere with their other stuff like hanging out with friends and going to work. They will miss out on parties that their friends will host for them. It help the students and the teachers because not everyone has a good ability like the other students. ",3.5
"Although some say students wouldn't benefit attending classes from home because students will not have the opportunity to work in groups with other students, actually students would benefit attending classes from home because they will feel comfortable and students can be more safe.

Those who believed not being able to attend classes fom home wouldn't benefit students because they can't work with other students. Around 200 articles said that students that attend online classes don't have the best projects just because they can't have other student's opinion. For example, so many different ideas by having a group can be more interesting than only having a person's ideas.

However, students would benefit attending classes from home because they can feel comfortable. Furthermore, a school survey showed that students prefer online clases because that makes them feel comfortable just to be seated inappropriate. I agree with these people because I like to be seated in many ways, but in school rules is only a way to be seated.

Also, students would benefit attending classes from home because they can be more safe. Lately, more than hundred school shootings had happened, so it show us being at school can be dangerous. Other big danger can be gangs at school they can be an influence with so many bad things on a child's life.

In my opinion being able to attend classes at home can make parents happy; they don't have to be worried for their child's safety.

As you can see students wouldn't benefit from being able to attend classes from home because students can't stay connect with other students, actually being able to attend classes from home would make students feel comfortable and secure. ",2.5
